Title,Company,Location,Type,Level,YearsExp,Country,Skills
Production Manager,Confidential, Giza,Full Time,Manager,6+ Yrs of Exp,Egypt,"Production, Furniture, Factory, Wood, Decor, Manufacturing/Production"
Inside Sales Specialist,Confidential, New Cairo,Full Time,Entry Level,1-3 Yrs of Exp,Cairo,"Sales Skills, Customer Service, marketing, CRM, Lead Generation, Arabic, English, French, Telesales, Sales/Retail"
HR Specialist - Recruitment,Etisal EG, Sheraton,Full Time,Experienced,2-5 Yrs of Exp,Cairo,"Human Resources (HR), HR, Recruitment, Business Administration, Microsoft Office, Personnel, Communication Skills, Industry"
Product Owner,Confidential, Nasr City,Full Time,Experienced,4-6 Yrs of Exp,Cairo,"Product Owner, Software Engineering, Software Development, Information Technology (IT), Agile, Computer Science, Business"
Senior Sales Specialist,JIT International Logistics, Sheraton,Full Time,Experienced,2-6 Yrs of Exp,Cairo,"Sales Skills, Freight, Selling, Sales Target, Business Development, Logistics/Supply Chain, Sales/Retail"
Beauty Advisor - Gulf Area,Confidential, Victoria,Part Time,Freelance / Project,0-1 Yrs of Exp,Alexandria,"0-1 Yrs of Exp, 10 Vacancies, Pharmacy, Science, Beauty, Cosmetics, Gulf Area, R&D/Science, Customer Service/Support"
Furniture Manufacturing Specialist,DIVANO, Maadi,Full Time,Manager,5+ Yrs of Exp,Cairo,"Applied Arts, Manufacturing, Furniture, AutoCAD, Production, Design, Creative/Design/Art, Manufacturing/Production"
IOS Team Lead,Confidential, Nasr City,Full Time,Manager,6-8 Yrs of Exp,Cairo,"iOS, Scrum, Computer Science, Information Technology (IT), Computer Engineering, Code Versioning, ObjC, Swift, IT/Software Development"
Senior Compensation & Benefits Specialist,First Group, Mohandessin,Full Time,Experienced,4-5 Yrs of Exp,Giza,"Payroll, English, Compensation & Benefits, Human Resources"
Activity Teacher,Windrose Academy, Maadi,Full Time,Entry Level,1-3 Yrs of Exp,Cairo,"Teaching, Physical Education, English, International School, Sports, Sports and Leisure, Education/Teaching"
Sales Executive (Automotive/Lubricants),Solkit Egypt, Mokattam,Full Time,Experienced,3+ Yrs of Exp,Cairo,"Indoor Sales, Outdoor Sales, Sales Skills, Lubricants, Car Oils, Automotive, Sales Target, Sales/Retail"
Sales Representative - Furniture,DIVANO, Maadi,Full Time,Experienced,2-5 Yrs of Exp,Cairo,"Sales Target, Furniture, Sales Skills, Customer Service, Communication Skills, Sales/Retail"
Senior Oracle Adf Developer - Cairo,Linux Plus Information Systems, Maadi,Full Time,Experienced,3-5 Yrs of Exp,Cairo,"Oracle SOA, Oracle ADF, Information Technology (IT), Computer Science, Software Development, IT/Software Development"
Sales Representative,ACS logistic company, Gomrok,Full Time,Entry Level,0-3 Yrs of Exp,Alexandria,"Sales Target, Customer Service, Microsoft Office, Sales Representative, Logistics, Negotiation Skills, Communication Skills"
Senior Sales Executive,Future Group, Mohandessin,Full Time,Work From Home,3+ Yrs of Exp,Giza,"Sales Skills, Sales Target, Customer Service, Customer Care, Customer Support, English, Business Development, Sales/Retail"
Laboratory Analyst,Alumil, 6th of October,Full Time,Entry Level,1-2 Yrs of Exp,Giza,"Laboratory, Science, R&D/Science"
Senior Recruitment Specialist,First Group, Mohandessin,Full Time,Experienced,4-5 Yrs of Exp,Giza,"Human Resources (HR), HR, Real Estate, Construction, English, Human Resources"
Student Life Manager,El Sewedy Education, Cairo,Full Time,Manager,8-10 Yrs of Exp,Egypt,"Development, Engagement, Other"
Systems Analyst,Safa Soft, Maadi,Full Time,Experienced,3+ Yrs of Exp,Cairo,"System Analysis, Software Documentation, Software Testing, SRS, OOP, MySQL, Agile, Scrum, IT/Software Development"
Digital Marketing Specialist,CarlCare, Downtown,Full Time,Entry Level,1-5 Yrs of Exp,Cairo,"Social Media, E-marketing, Adobe Photoshop, Adobe Illustrator, Digital Media, Marketing/PR/Advertising, Media/Journalism/Publishing"
Light Current Pre -Sales Engineer,Electro Mechanic for Energy (EME), New Heliopolis,Full Time,Entry Level,1-5 Yrs of Exp,Cairo,"Installation, Light Current, Communication, Access Control, Fire Alarm, Engineering, Sales Skills, Visio, Information Technology (IT)"
Local Purchasing Section Head,Hi Pharm, Cairo,Full Time,Manager,5-8 Yrs of Exp,Egypt,"Supply Chain, Pharmaceutical, Logistics, Local Purchasing, Logistics/Supply Chain, Purchasing/Procurement"
Senior Site Engineer,Ryan, Cairo,Full Time,Manager,15+ Yrs of Exp,Egypt,"Civil Engineering, Construction, Mechanical, Electrical, Engineering - Construction/Civil/Architecture, Engineering - Mechanical/Electrical"
Social Media Moderator,Queens Health Care, Cairo,Full Time,Experienced,2-4 Yrs of Exp,Egypt,"Communication, E-marketing, Online Marketing, English, Arabic, Marketing/PR/Advertising, Media/Journalism/Publishing"
Admin Assistant,Tiger Med For Medical Agencies, Cairo,Full Time,Experienced,2-7 Yrs of Exp,Egypt,"Office Management, Microsoft Office, Administration, Administration, Customer Service/Support, Operations/Management"
Technical Customer Support Engineer (Handover),M² Developments, Mohandessin,Full Time,Experienced,5-7 Yrs of Exp,Giza,"Technical Support, Civil Engineering, Customer Support, Customer Service, Engineering - Construction/Civil/Architecture"
Receptionist,Confidential, New Nozha,Full Time,Entry Level,1+ Yrs of Exp,Cairo,"Secretary, Administration, Office Management, Microsoft Office, Receptionist, Front Office, Front Desk, Customer Service, MS Office"
Software Development Technical Head (.Net),Orient Egypt, Dokki,Full Time,Manager,15-20 Yrs of Exp,Giza,"Information Technology (IT), Software Development, Software Engineering, TFS, C++, Python, Design Patterns, .NET, SaaS, Cloud"
Network Administrator,Energya Cables, 10th of Ramadan City,Full Time,Experienced,5-7 Yrs of Exp,Sharqia,"Computer Science, IT, Network Administration, Networking, MCSE, MCSA, Routing, Switching, IT/Software Development"
Key Account Manager,Rashideen Egypt for Trade, Basatin,Full Time,Manager,5+ Yrs of Exp,Cairo,"FMCG, Sales Skills, Customer Care, Customer Service, English, Customer Service/Support, Sales/Retail"
Senior PHP Developer (Laravel),Our Education, Nasr City,Full Time,Experienced,3-5 Yrs of Exp,Cairo,"PHP, Computer Science, Laravel, HTML5, CSS3, MVC, Programming, javaScript, Information Technology (IT), Servers, Git, Front-End"
Senior Vue Developer,Our Education, Nasr City,Full Time,Experienced,3-5 Yrs of Exp,Cairo,"Information Technology (IT), javaScript, HTML5, Vue, CSS3, React, SASS, LESS, Computer Science, Development, SEO, Engineering"
Software Development Team leader,Our Education, Nasr City,Full Time,Manager,5+ Yrs of Exp,Cairo,"Software Development, Software Engineering, Computer Science, Web Development, PHP, OOP, Angular, Testing, Laravel"
Senior Sales Engineer,International co for Electrical & Electronic Industries Electro George, Cairo,Full Time,Experienced,4-6 Yrs of Exp,Egypt,"Engineering, Sales Target, Low Voltage, ABB, Gas, Oil, Switchgear, English, Parts, Computer Skills, Sales/Retail"
Node.js / React / Next.js & Liquid Developer,MatsMall, Cairo,Full Time,Work From Home,2-4 Yrs of Exp,Egypt,"Computer Science, HTML5, Node.js, React, javaScript, Information Technology (IT), Software Development, JSON, Front-End, jQuery"
"Project Engineer ""AutoCAD Expert""",Mamiba, 6th of October,Freelance / Project,Experienced,2-4 Yrs of Exp,Giza,"Microsoft Office, English, Civil, Architect, Engineering, Engineering - Construction/Civil/Architecture, Project/Program Management"
Sales Executive - B2B Channel,Cairo Trading, Cairo,Full Time,Experienced,2+ Yrs of Exp,Egypt,"Sales Target, B2B, Sales/Retail"
Sales Executive - Power Retailer,Cairo Trading, Cairo,Full Time,Experienced,2+ Yrs of Exp,Egypt,"Sales Target, Mechanical Engineering, Sales Engineering, Sales/Retail, Engineering - Mechanical/Electrical"
Junior Mechanical Sales Engineer,Imatec company, Downtown,Full Time,Experienced,5+ Yrs of Exp,Cairo,"Sales Skills, Pumps, Sales Target, Sales/Retail, Engineering - Mechanical/Electrical"
Senior Mechanical Sales Engineer,Imatec company, Downtown,Full Time,Experienced,10+ Yrs of Exp,Cairo,"Sales Skills, Pumps, Sales Target, Sales/Retail, Engineering - Mechanical/Electrical"
Secretary/ Receptionist,Imatec company, Downtown,Full Time,Experienced,10+ Yrs of Exp,Cairo,"Administration, Secretary, Office Management, Microsoft Office, Administration"
Planning Site Engineer,Teraz, Khobar,Full Time,Entry Level,1-3 Yrs of Exp,Saudi Arabia,"AutoCAD, Projects, Primavera, Construction, Microsoft Office, Civil Engineering, Engineering - Construction/Civil/Architecture"
Executive Assistant,NADIM, Abu Rawash,Full Time,Experienced,2-5 Yrs of Exp,Giza,"Administration, Office Management, Secretary, English, Administration"
Google Analytics & Google Tag Specialist,Deal, Alexandria,Full Time,Part Time,1+ Yrs of Exp,Egypt,"1+ Yrs of Exp, SEO, Digital Marketing, Social Media, Search Engine, Google Analytics, SEM, Google Tag Manager, GTM"
Sales Team Leader,JIT International Logistics, Cairo,Full Time,Manager,6-15 Yrs of Exp,Egypt,"Sales Target, English, Logistics, Supply Chain, Freight Service, Logistics/Supply Chain, Sales/Retail"
Senior Site Engineer,Wadi Degla Group, Maadi,Full Time,Experienced,7-9 Yrs of Exp,Cairo,"Site, Project Management, Engineering - Construction/Civil/Architecture, Project/Program Management"
Senior Real Estate Sales Consultant,Elyasmen & Jamar For Real Estate, New Cairo,Full Time,Shift Based,2-5 Yrs of Exp,Cairo,"6 Vacancies, Brokerage, Real Estate Broker, Property Consultant, Sales Skills, Sales Target, Properties, Microsoft Office"
Operation Accountant - Alexandria,EGIC, Alexandria,Full Time,Entry Level,1-2 Yrs of Exp,Egypt,"Finance, Accounting, Commerce, Budget, Reporting, Payroll, AR, Accounts Receivables, Cash, Treasury, Operations, Audit"
PHP Developer,"The Micro, Small & Medium Enterprise Development Agency", Dokki,Full Time,Experienced,2-5 Yrs of Exp,Giza,"Computer Science, Software Development, PHP, javaScript, HTML, MySQL, jQuery, AJAX, XML, Communication Skills"
User Experience (UX) Designer,Deal, Alexandria,Full Time,Part Time,3+ Yrs of Exp,Egypt,"3+ Yrs of Exp, UI/UX, Sketch, Adobe XD, Wireframes, UX, Information Technology (IT), Computer Science, Prototypes"
Technical Support Engineer,ARPUPLUS, Agouza,Full Time,Entry Level,1-2 Yrs of Exp,Giza,"Information Technology (IT), RBT, Linux, Windows, IVR, SLA, Customer Care, Troubleshooting, Computer Science, MCSA, MSSQL"
Front Office Admin,New Plan, Heliopolis,Full Time,Experienced,2-4 Yrs of Exp,Cairo,"Administration, Microsoft Office, English, Hospitality, Office Management, Real Estate, Customer Service, Customer Support"
Data Architect - Saudi Arabia,Altayar recruitment, Riyadh,Full Time,Experienced,2+ Yrs of Exp,Saudi Arabia,"Computer Science, Computer Engineering, Database, IT/Software Development, Engineering - Telecom/Technology"
Customer Service Agent,Confidential, Giza,Full Time,Shift Based,0-2 Yrs of Exp,Giza,"7 Vacancies, Customer Support, Customer Service, Communication, English, Customer Care, Presentation Skills, Call Center"
React Native App Developer (Internship),Seuqel Solutions, Downtown,Internship,Student,0-1 Yrs of Exp,Cairo,"Startup, Information Technology (IT), Computer Science, Nodejs, Engineering, Redux, UI, UX, REST, mongodDB, React Native, English"
Architectural Draftsman,Egypro FME, Maadi,Full Time,Experienced,2-5 Yrs of Exp,Cairo,"AutoCAD, Engineering, Drawing, Architectural, Engineering - Construction/Civil/Architecture, Creative/Design/Art"
B2B Sales Executive,Naql Masr, Obour City,Full Time,Entry Level,1-3 Yrs of Exp,Cairo,"Logistics, Supply Chain, Sales Skills, Sales Target, B2B, Business Development, Sales/Retail"
Steel Structural Engineer - China,Sinoma-cdi, Chengdu,Full Time,Experienced,15-17 Yrs of Exp,China,"Civil Engineering, Steel Structure, Structural Engineering, AutoCAD, Design Engineering, Structural Design, English, Project"
Senior ASP.Net MVC Developer,3i Vision LTD., Dokki,Full Time,Experienced,4-6 Yrs of Exp,Giza,"ASP.NET, C#, javaScript, Agile, C#.Net, TFS, Programming, Entity Framework, Information Technology (IT), Computer Science, MVC"
Customer Service Officer,SASA, 10th of Ramadan City,Full Time,Experienced,2-4 Yrs of Exp,Cairo,"Customer Care, Customer Support, Microsoft Office, Communication Skills, Customer Service/Support"
Installation Engineer,Alpha Trade, Dokki,Full Time,Entry Level,0-1 Yrs of Exp,Giza,"Mechatronics, Electrical Engineering, Mechanical Engineering, CNC, Arduino, Classic Control, Ladder Diagrams"
Sales Accountant - Kafr Alsheikh,EGIC, Kafr Alsheikh,Full Time,Entry Level,0-3 Yrs of Exp,Egypt,"Finance, Sales Accounting, Commerce, Budget, Reporting, Sales Skills, Sales Target, Customer Service, Communication"
Sales Representative,Golden AR, 10th of Ramadan City,Full Time,Entry Level,1+ Yrs of Exp,Sharqia,"Sales Target, Customer Service, Medical, Microsoft Office, English, Computer Skills, Medical/Healthcare, Sales/Retail"
Sales Accountant - Ismailia,EGIC, Ismailia,Full Time,Entry Level,0-3 Yrs of Exp,Egypt,"Finance, Sales Accounting, Commerce, Budget, Reporting, Accounting/Finance"
General Accountant,Keys Group Services, Maadi,Full Time,Experienced,3-5 Yrs of Exp,Cairo,"Accounting, Finance, Taxing, GL, English, Commerce, GL Accountant, Financial Analysis, Financial Management, WHT, VAT"
Sales Accountant - Gharbia,EGIC, Gharbia,Full Time,Entry Level,0-3 Yrs of Exp,Egypt,"Finance, Sales Accounting, Commerce, Budget, Reporting, Accounting/Finance"
Logistics Sales Manager,Confidential, Alexandria,Full Time,Manager,8-12 Yrs of Exp,Egypt,"Logistics, Supply Chain, Management, Logistic Sales Manager, Sales Target, Logistics/Supply Chain, Sales/Retail"
Junior Techno Commercial Engineer,International co for Electrical & Electronic Industries Electro George, Cairo,Full Time,Experienced,2-3 Yrs of Exp,Egypt,"English, Computer skills, ABB, Switchgear, AutoCAD, Microsoft Office, Engineering - Mechanical/Electrical"
Senior Techno Commercial Engineer,International co for Electrical & Electronic Industries Electro George, Cairo,Full Time,Experienced,5-9 Yrs of Exp,Egypt,"Project Management, English, AutoCAD, Commercial, RFQ, RFI, Microsoft Office, Switchgear, Sales, Pricing"
Business Development Specialist,MTS Logistics, Cairo,Full Time,Experienced,2+ Yrs of Exp,Egypt,"Sales Skills, Logistics, Sales Target, Arabic, English, Fright Forwarding, MS Office, Business Development, Sales/Retail"
Credit Control Specialist,MTS Logistics, Cairo,Full Time,Experienced,3-6 Yrs of Exp,Egypt,"Accounting, Credit Control, Microsoft Office, Accounting/Finance"
Sales Accountant - Damietta,EGIC, Damietta,Full Time,Entry Level,0-3 Yrs of Exp,Egypt,"Finance, Sales Accounting, Commerce, Budget, Reporting, Accounting/Finance"
Sales Accountant - Dakahlia,EGIC, Dakahlia,Full Time,Entry Level,0-3 Yrs of Exp,Egypt,"Finance, Sales Accounting, Commerce, Budget, Reporting, Accounting/Finance"
Senior Sales Representative Real Estate,Next Home For Real Estate, New Cairo,Full Time,Experienced,2-5 Yrs of Exp,Cairo,"Females Preferred, Real Estate, Sales Target, Communication Skills, Presentation Skills, Negotiation Skills, Sales Skills, broker"
IT Manager,Ameco Medical Industries, 10th of Ramadan City,Full Time,Manager,8+ Yrs of Exp,Sharqia,"Software Development, Software Engineering, Computer Science, Manufacturing, ERP, CRM, Infrastructure, SCM, Medical"
Junior Legal Advisor,Alumil, Heliopolis,Full Time,Entry Level,1+ Yrs of Exp,Cairo,"Law, Legal, Governmental Affairs, English, Legal"
Fulfillment Point Manager,Breadfast, Cairo,Full Time,Manager,3+ Yrs of Exp,Egypt,"Hub, Fulfillment Center, Inventory, Operations, Logistics, Supply Chain, Order fulfillment, Management, Leadership, Communication"
Sales Accountant - Beheira,EGIC, Beheira,Full Time,Entry Level,0-3 Yrs of Exp,Egypt,"Finance, Sales Accounting, Commerce, Budget, Reporting, Accounting/Finance"
Business Analyst,Brandshub.co, Mohandessin,Full Time,Entry Level,1-3 Yrs of Exp,Giza,"Economics, Business Administration, Statistics, English, Excel, Business Development, Pricing, Sales, Business Development"
Senior Software Developer (.Net Core + React JS),CrossWorkers, Cairo,Full Time,Experienced,3+ Yrs of Exp,Egypt,"Information Technology (IT), Computer Science, Software Development, HTML, Full Stack, Software Engineering, C#, SQL, ReactJS"
Sales Accountant - Suez,EGIC, Suez,Full Time,Entry Level,1-3 Yrs of Exp,Egypt,"Finance, Sales Accounting, Commerce, Budget, Reporting, Accounting/Finance"
Accountant - Alexandria,Egaz, Alexandria,Full Time,Experienced,5+ Yrs of Exp,Egypt,"Accounting, Finance, Financial Analysis, Financial Management, Microsoft Office, Excel, Pharmaceutical, Word, Accounting/Finance"
Executive Secretary / Pharmaceutical Industry -...,Egaz, Alexandria,Full Time,Experienced,10+ Yrs of Exp,Egypt,"Administration, Office Management, ICDL, E-marketing, English, Pharmaceutical, Administration"
Operations Manager - Alexandria,Egaz, Alexandria,Full Time,Manager,5+ Yrs of Exp,Egypt,"Operations, Management, Logistics, E-marketing, English, Export, Commerce, Import, Microsoft Office, Operations/Management"
University Registration Manager,Sinai University, Qantarah Sharq,Full Time,Manager,7+ Yrs of Exp,Ismailia,"Admission, Registration, Administration, Administration, Education/Teaching"
B2B SaaS Growth Hacker,Appgain, Dokki,Full Time,Experienced,3+ Yrs of Exp,Giza,"Social Media, E-marketing, SEO, SEM, PPC, Digital Marketing, Google Analytics, Growth Hacking, English, Data Analytics"
Sales Accountant - Sharqia,EGIC, Sharqia,Full Time,Entry Level,0-3 Yrs of Exp,Egypt,"Finance, Sales Accounting, Commerce, Budget, Reporting, Accounting/Finance"
Sales Accountant - Qalubia,EGIC, Qalubia,Full Time,Entry Level,0-3 Yrs of Exp,Egypt,"Finance, Sales Accounting, Commerce, Budget, Reporting, Accounting/Finance"
NopCommerce Web Application Support Engineer,Crystal Mind, Nasr City,Full Time,Experienced,4-6 Yrs of Exp,Cairo,"Customer Support, Information Systems, E-Commerce, English, Application Support, Information Technology (IT), Computer Science"
Sales Engineer - Heliopolis,Alumil, Heliopolis,Full Time,Entry Level,1+ Yrs of Exp,Cairo,"Solar Energy, Engineering, Sales Skills, Client Relationships, Solar Sales, Account Management, Customer Service, Customer Care"
Architectural Engineer - Interior Design,Signtech Communications S.A.E, Nasr City,Full Time,Experienced,3-4 Yrs of Exp,Cairo,"Engineering, AutoCAD, 3D Max, Sketchup, Decor, Interior Design, Engineering - Construction/Civil/Architecture, Creative/Design/Art"
Sales Accountant - Monufya,EGIC, Monufya,Full Time,Entry Level,0-3 Yrs of Exp,Egypt,"Finance, Sales Accounting, Commerce, Budget, Reporting, Accounting/Finance"
Front Desk Coordinator,Dawi Clinics, Helwan,Full Time,Entry Level,1-3 Yrs of Exp,Cairo,"Administration, Customer Service, Microsoft Office, Communication Skills, Office Management, Front Desk, MS Office, Sales Skills"
Material Planning Specialist/Engineer,Masria Digital Payment (MDP), 10th of Ramadan City,Full Time,Entry Level,1-3 Yrs of Exp,Sharqia,"Material, Industrial, Planning, Supply Chain, Logistics, SAP, Logistics/Supply Chain, Purchasing/Procurement"
Mechanical Material Planning Engineer,Chint Egemac, 6th of October,Full Time,Entry Level,1-3 Yrs of Exp,Giza,"Mechanical Engineering, SAP, Design, Production, Mechanical Raw Material, Raw Material Planning, Metal Drawings, English, Busbar"
Sales Accountant - Alexandria,EGIC, Agami,Full Time,Entry Level,1-3 Yrs of Exp,Alexandria,"Males Only, Finance, Sales Accounting, Commerce, Budget, Reporting, Accounting/Finance"
Accountant,Signtech Communications S.A.E, Nasr City,Full Time,Entry Level,1-3 Yrs of Exp,Cairo,"Finance, Accounting, Financial Analysis, Financial Management, Accounting/Finance"
Medical Representative (Maadi & Helwan),So Value Pharma, Cairo,Full Time,Entry Level,1+ Yrs of Exp,Egypt,"Sales Skills, Sales Target, Customer Service, Customer Care, Customer Support, Pharmacy, Pharmaceutical, Science, Medical Sales"
Clinical Sales Manager,CMR Egypt, Maadi,Full Time,Manager,5-8 Yrs of Exp,Cairo,"Sales Skills, Medical Sales, English, Clinical Sales, Medical/Healthcare, Sales/Retail"
Receptionist,Mazaya, New Cairo,Full Time,Entry Level,1-3 Yrs of Exp,Cairo,"Administration, Office Management, Microsoft Office, Front Office, Secretary, English, Administration"
Admin Coordinator - Alexandria,Shamy Stores, Sidi Gaber,Full Time,Experienced,2-2 Yrs of Exp,Alexandria,"Administration, Excel, Communication, Office Admin, Microsoft Office, Office Management, MS Office, Emails, MS, Administration"
Full-Stack WordPress Developer,Confidential, Heliopolis,Full Time,Experienced,3-5 Yrs of Exp,Cairo,"Information Technology (IT), Computer Science, PHP, WordPress, JQuery, English, javaScript, HTML5, CSS3, Front-End"
Marketing Technology Specialist,Confidential, Maadi,Full Time,Entry Level,1+ Yrs of Exp,Cairo,"Computer Science, Telecom Engineering, CRM, PHP, HTML, SQL, ERP, E-marketing, Social Media, REST, JavaScript, SOAP, Python"
Graphic Designer,ExaServe LLC, Nasr City,Full Time,Experienced,2-4 Yrs of Exp,Cairo,"Graphic Design, Adobe Illustrator, Adobe Photoshop, InDesign, Creative/Design/Art"
Security & Safety Supervisor,The International School of Elite Education, New Cairo,Full Time,Experienced,2+ Yrs of Exp,Cairo,"English, Security, Safety, Administration, Administration, Other"
Project Sales Engineer,SOS HR Solutions, Obour City,Full Time,Experienced,3-5 Yrs of Exp,Cairo,"Industrial Engineering, Industrial Refrigeration, Sales Skills, English, Arabic, Sales/Retail"
Senior Accountant (Banks & Cash),Transmar International, New Cairo,Full Time,Work From Home,3-5 Yrs of Exp,Cairo,"MS Excel, Accounting, Finance, Financial Analysis, Banking, Accounts Payable, Accounts Receivable, Accounting/Finance"
Content Creator (Arabic),"Izam, inc.", Mohandessin,Full Time,Entry Level,1-3 Yrs of Exp,Giza,"SEO, ERP, Marketing, Social Media, English, Arabic, Content Writing, Microsoft Office, Translation, Writing/Editorial"
Social Media Manager,Profolio Consulting, Maadi,Full Time,Manager,5-6 Yrs of Exp,Cairo,"Digital Marketing, Content Writing, Copywriting, B2B, Adobe Creative Suite, Demand Generation Marketing, Inbound Marketing, Blogging"
Customer Acquisition Specialist,Confidential, Maadi,Full Time,Part Time,0-1 Yrs of Exp,Cairo,"3 Vacancies, Females Only, Communication Skills, Customer Acquisition, Voiceover, Voice-over, Operations/Management, Sales/Retail"
Graphic Designer,Profolio Consulting, Maadi,Full Time,Experienced,2-3 Yrs of Exp,Cairo,"Adobe Photoshop, Adobe Illustrator, Marketing, Adobe Creative Suite, Animation, Designer, Videography, SaaS, Creative/Design/Art"
Account Manager (Recruitment Background),"Izam, inc.", Mohandessin,Full Time,Experienced,2-4 Yrs of Exp,Giza,"Recruitment, English, Sourcing, Screening, Customer Service, Customer Service/Support, Human Resources"
Director Executive Assistant,Confidential, Alexandria,Full Time,Experienced,2+ Yrs of Exp,Egypt,"Administration, Admin Assist, Assistant, Executive Secretary, Arabic, English, Administration"
Electrical Technical Office Engineer,E&Power, 6th of October,Full Time,Entry Level,1-3 Yrs of Exp,Giza,"Electrical Engineering, AutoCAD 2D, Microsoft Office, Management, Contracting, Engineering - Mechanical/Electrical"
Digital Marketing Intern,Appgain, Dokki,Internship,Entry Level,0-1 Yrs of Exp,Giza,"Google Analytics, Digital Marketing, SMM, SEO, Google Adwords, Social Media, English, Market Research, Marketing/PR/Advertising"
Senior Devops Engineer,Profolio Consulting, Maadi,Full Time,Experienced,2-3 Yrs of Exp,Cairo,"Information Technology (IT), DevOps, Software Engineering, Development, Cloud Systems, Networking, IT/Software Development"
ERP Software Implementer,"Izam, inc.", Mohandessin,Full Time,Experienced,3-5 Yrs of Exp,Giza,"Accounting, Information Technology (IT), Computer Science, English, ERP Implementation, Typing, Technical Support"
Business Development Manager (Steel Or...,Confidential, Dokki,Full Time,Manager,15+ Yrs of Exp,Giza,"Business Development, Sales Skills, Engineering, Construction, Building Material, Export Engineer, Steel PEB, Steel Structure, Arabic"
Social Media Marketing Specialist,Itroots, Mansoura,Full Time,Entry Level,1-2 Yrs of Exp,Dakahlia,"E-marketing, Digital Marketing, English, Graphic Design, Campaigns, Ads, Microsoft Office, contact mangment, Editing"
Senior AP Accountant,Transmar International, New Cairo,Full Time,Experienced,3-5 Yrs of Exp,Cairo,"AP, Accounts Payable, Finance, Financial Analysis, CMA, English, Shipping, Stevedoring, Accounting/Finance"
Accountant,Chint Egemac, 6th of October,Full Time,Entry Level,0-2 Yrs of Exp,Giza,"Accounting, Financial Analysis, Financial Management, Manufacturing, English, Accounting/Finance"
Network Engineer,Eva Pharma, Haram,Full Time,Entry Level,0-3 Yrs of Exp,Giza,"Computer Science, Networking, Information Technology (IT), Engineering, English, Implementation, IS, IT/Software Development"
Customer Service Agent,Royal Herbs, Giza,Full Time,Experienced,2-3 Yrs of Exp,Egypt,"Customer Support, Customer Care, Customer Service/Support"
Senior Creative UI/UX Designer,Kick Start Interactive, Dokki,Full Time,Freelance / Project,5+ Yrs of Exp,Giza,"Information Technology (IT), Computer Science, Computer Engineering, Software Development, Web Development, Web Design, UI"
Senior Java Developer,DMS, Heliopolis,Full Time,Experienced,3+ Yrs of Exp,Cairo,"Computer Science, Computer Engineering, ITI, JSF, J2EE, SE, JPA, EJB, Hibernate, Glassfish, Tomcat, Weblogic, Oracle, SVN"
Marketing Head - E-Commerce,Arma, Heliopolis,Full Time,Manager,5-7 Yrs of Exp,Cairo,"Social Media, Business Administration, MBA, Aviation, Management, E-Commerce, E-marketing, Operations/Management"
