Title,Company,Location,Type,Level,YearsExp,Country,Skills
GL Accountant,Cairoscan, Mohandessin,Full Time,Experienced,2-5 Yrs of Exp,Giza,"Microsoft Office, Microsoft Excel, Finance, Commerce, Financial Management, Financial Analysis, Computer Skills, GL, General Ledger"
Pharma Sales Representative,World Business Fitness, New Cairo,Full Time,Experienced,3-4 Yrs of Exp,Cairo,"Medical, Pharmaceutical, Negotiation, Communication, Sales/Retail, Pharmaceutical"
Front Desk Receptionist- Night Shift,Al fawzy dental, Agouza,Full Time,Experienced,2-3 Yrs of Exp,Giza,"Administration, Office Management, English, Communication, Microsoft Office, Administration, Customer Service/Support"
Pharma Tele-Sales Representative,World Business Fitness, Cairo,Full Time,Experienced,3-4 Yrs of Exp,Egypt,"Customer Support, Sales Skills, Sales Target, Pharmaceutical, Sales/Retail, Pharmaceutical"
Senior Full Stack Java Developer,Confidential, Cairo,Part Time,Work From Home,3-4 Yrs of Exp,Egypt,"2 Vacancies, Agile, Angular, Information Technology (IT), Computer Science, Software Development, javaScript, Docker, NodeJS"
Technical Consultant,Ultimate Solutions Egypt, 6th of October,Full Time,Entry Level,0-2 Yrs of Exp,Giza,"Software, banking, technical support, Java, C++, Programming, Computer Science, Information Technology (IT), Oracle, XML, IT"
Sybase Database Administrator,ITS, Cairo,Full Time,Experienced,2+ Yrs of Exp,Egypt,"Databases, Sybase Database Administration, MySQL, Oracle, Performance Tuning, Sybase ASE, Sybase IQ, IT/Software Development"
Foreign Purchasing Specialist,Confidential, 6th of October,Full Time,Entry Level,0-2 Yrs of Exp,Giza,"Procurement, English, Microsoft Office, Supply Chain, Logistics, Shipping, Purchasing/Procurement"
Quality Control Inspector - Wood & Metal,Hanimex, Obour City,Full Time,Experienced,3-5 Yrs of Exp,Cairo,"Quality Control, Furniture, Audit, Production, Quality Assurance, QA, Wood Inspection, Metal Inspection, Manufacturing/Production, Quality"
Planning & follow up Manager,Hanimex, Obour City,Full Time,Manager,6-9 Yrs of Exp,Cairo,"Supply Chain, Microsoft Office, Logistics, Shipping, Material Planning, Production Planning, Raw Material, Logistics/Supply Chain"
Sales And Marketing Specialist - Females Only,Pure Facilities, Giza,Full Time,Work From Home,1-3 Yrs of Exp,Egypt,"Females Only, Sales Skills, Marketing, Sales Target, Advertising, Publicity, Media, Marketing/PR/Advertising, Sales/Retail"
Social Media Designer,Egypt Yellow Pages, Maadi,Full Time,Entry Level,1-3 Yrs of Exp,Cairo,"Adobe Illustrator, Graphic Design, Adobe Photoshop, After Effects, Creative/Design/Art, Marketing/PR/Advertising"
Software QC Tester,Ithmaar Integrated Solutions, Giza,Full Time,Entry Level,1-3 Yrs of Exp,Egypt,"Computer Science, Information Technology (IT), QC, QA, Automation, Software Development, Performance Testing, Computer Engineering"
Operations Auditor,Mishkat Nour, Nasr City,Full Time,Experienced,3-7 Yrs of Exp,Cairo,"Auditing, Operations, Financial Analysis, Accounting, Finance, Computer Skills, Accounting/Finance, Operations/Management"
Java Backend Developer (Spring/ADF),Ithmaar Integrated Solutions, Haram,Full Time,Experienced,2-4 Yrs of Exp,Giza,"Java, Software Development, Information Technology (IT), ADF, Software Engineering, Back-End, Spring Boot, J2EE, Hibernate"
Java Engineer,siParadigm Egypt, Sheraton,Full Time,Experienced,2-4 Yrs of Exp,Cairo,"Software Development, Java, Information Technology (IT), Computer Science, MYSQL, Linux, J2EE, Angular 6, Spring Boot, PostgreSQL"
Senior Angular Developer,Generation C, Nasr City,Full Time,Experienced,3+ Yrs of Exp,Cairo,"Angular, Computer Science, Software Development, javaScript, Git, Engineering, Information Technology (IT), Telecom, jQuery"
Warehouse Manager - Mit Ghamr (Pharmacist),Ibn Sina Pharma, Mit Ghamr,Full Time,Manager,0-2 Yrs of Exp,Dakahlia,"Warehouse Manager, Pharmacy, Pharmaceutical Sciences, Logistics, Supply Chain, Lean Warehouse, Six Sigma, Management, Administration"
Telesales Manager,Confidential, Hadayek Alahram,Full Time,Manager,4+ Yrs of Exp,Giza,"Telesales, Customer Service, Sales Target, Software, Zoho, Microsoft Office, Sales Skills, English, Management, Customer Service/Support"
Sales Engineer - Kitchens,Confidential, Maadi,Full Time,Experienced,2-5 Yrs of Exp,Cairo,"3DMAX, AutoCAD, Graphic Design, Architecture, Construction, Applied Arts, Interior Design, Architectural, Technical Support"
Blogger / Content Writer (Internship),Businessita Women Empowerment, Cairo,Internship,Student,0-1 Yrs of Exp,Egypt,"Editing, Writing Skills, Media, Content Writing, Content Development, Arabic, English, Blogging, Writing/Editorial"
Full Stack Developer Angular & Java ( R&D ),Cegedim, New Cairo,Full Time,Experienced,2+ Yrs of Exp,Cairo,"Information Technology (IT), Java, Computer Science, Computer Engineering, Software Engineering, System Design, Data Structure, TDD"
Graphic Designer - Internship,Businessita Women Empowerment, Cairo,Internship,Student,0-1 Yrs of Exp,Egypt,"Creativity, Adobe Photoshop, Adobe Illustrator, Internship, Creative/Design/Art"
Receptionist and Customer Service Representative,Confidential, Maadi,Full Time,Entry Level,1-3 Yrs of Exp,Cairo,"Retail, Show Room, Customer Service, Customer Care, Furniture Sales, Customer Support, AdministrationA, Admin Work, Administration"
Branch Manager - Nasr City,4level1, Nasr City,Full Time,Manager,2-3 Yrs of Exp,Cairo,"Customer Service, Branch Management, Administration, Communication, Retail, Customer Service/Support, Operations/Management, Sales/Retail"
Web Developer,Yis Web, Sheikh Zayed,Full Time,Experienced,3-5 Yrs of Exp,Giza,"Computer Science, Web Development, Software Development, javaScript, HTML, PHP, CSS, Git, MySQL, AJAX, Design"
Fashion Designer,Hala Garments, Agouza,Full Time,Experienced,2-4 Yrs of Exp,Giza,"Design, Adobe Photoshop, Adobe Illustrator, Creative, Clothing, Trends, Crafts, Creative/Design/Art, Fashion"
Android Developer,Yis Web, Sheikh Zayed,Full Time,Experienced,3-5 Yrs of Exp,Giza,"Computer Science, Software Development, Git, Android SDK, UI, Design, RESTful APIs, IT/Software Development"
Full Stack .Net Software Developer,Confidential, Heliopolis,Full Time,Experienced,2-5 Yrs of Exp,Cairo,"Microsoft.Net, C#, Website Development, CSS, HTML5, SEO, Windows Server, Software Development, IIS, XML, MySQL, jQuery"
UI/UX Designer,Yis Web, Sheikh Zayed,Full Time,Experienced,2-5 Yrs of Exp,Giza,"UI, UX, Computer Science, Design, Sketch, Illustrator, Android, User Interface, Wireframes, XD, Web, iOS"
iOS Mobile Developer,Yis Web, Sheikh Zayed,Full Time,Experienced,3-5 Yrs of Exp,Giza,"Information Technology (IT), iOS, Software Development, Mobile Development, APIs, App Store, Swift, cocoa, Core Animation"
English Instructors - Online,SYE English Community, Nasr City,Part Time,Freelance / Project,1+ Yrs of Exp,Cairo,"1+ Yrs of Exp, 5 Vacancies, Education, English Teaching, Professional Teaching Certificate, Instructing, Training"
Technical Office Engineer (Applied Arts or Fine...,Lotus Finishing Materials, Nozha,Full Time,Experienced,2-3 Yrs of Exp,Cairo,"Technical Office, MS Office, Applied Arts, Communication Skills, Microsoft Office, English, Engineering, 3D, Fine Arts, Architecture"
Medical Representative,Confidential, Cairo,Full Time,Entry Level,0-2 Yrs of Exp,Egypt,"Sales Skills, Medical, Representative, pharmaceutical, Sales Target, Veterinary, Science, Biochemistry, Biology, Medical/Healthcare"
Telesales Representative - US Account,PROJECS, Sheikh Zayed,Full Time,Entry Level,1+ Yrs of Exp,Giza,"Sales Skills, Customer Support, Customer Care, Telesales, English, Customer Service, Telemarketing, Call Center, Sales/Retail"
Marketing Manager,4level1, Maadi,Full Time,Manager,10-15 Yrs of Exp,Cairo,"Sales, Digital Marketing, Market Research, SEO, Online Marketing, Advertising, Brand management, Marketing/PR/Advertising"
Store Manager,Jollyland, Cairo,Full Time,Manager,3+ Yrs of Exp,Egypt,"Retail, Store Management, Sales Skills, Fashion, Customer Service, Store Manager, Business, Customer Service/Support, Sales/Retail"
Senior Software Engineer Backend (PHP),Togar, New Nozha,Full Time,Experienced,3-7 Yrs of Exp,Cairo,"PHP, Information Technology (IT), Software Development, CSS, Computer Science, javaScript, MySQL, HTML, OOP, AJAX, WordPress"
Senior Instructional Designer,Nahdet Misr Publishing Group, Mohandessin,Full Time,Experienced,3-7 Yrs of Exp,Giza,"ITI, English, Articulate, Creative/Design/Art"
Business Development Specialist,Talent 360, Cairo,Full Time,Entry Level,1-3 Yrs of Exp,Egypt,"Sales Skills, Marketing, Sales Target, Communication Skills, Business Development, Marketing/PR/Advertising"
Lawyer,Confidential, Cairo,Full Time,Part Time,5-15 Yrs of Exp,Egypt,"5 Vacancies, Legal, Microsoft Office, Law Firm, Legal"
Graphic Designer,Estabraq, Nasr City,Full Time,Experienced,2-6 Yrs of Exp,Cairo,"Graphic Design, Adobe Photoshop, Adobe Illustrator, InDesign, Adobe Creative Suite, Creative/Design/Art"
Showroom Sales Assistant,Estabraq, Madinaty,Full Time,Experienced,2-4 Yrs of Exp,Cairo,"Showroom Sales, Retail Sales, Fashion, Customer Service, Customer Service/Support, Sales/Retail, Fashion"
Sales Engineer,3Brothers, Heliopolis,Full Time,Entry Level,1-2 Yrs of Exp,Cairo,"Sales Skills, Electrical Power Engineering, Microsoft Office, Electrical Engineering, Sales Target, Communication Skills, MS Office"
Surveillance Operator - Tanta,Town Team, Tanta,Full Time,Experienced,2+ Yrs of Exp,Gharbia,"Admin, CCTV, Surveillance Systems, Installation/Maintenance/Repair, Engineering - Telecom/Technology"
Front End Developer,Genify.ai, Cairo,Full Time,Work From Home,1-2 Yrs of Exp,Egypt,"HTML5, CSS3, Ionic, Angular, React Native, Git, UI, UI/UX, Python, Information Technology (IT), Computer Science, javaScript"
BI-Data Analyst,AQARITO, Maadi,Full Time,Part Time,1-3 Yrs of Exp,Cairo,"Computer Science, Power BI, SQL, BI, Data Analytics, Business Data, English, Database, Data Analysis, Business Development"
Receiving Specialist,Maxab, Cairo,Full Time,Shift Based,0-1 Yrs of Exp,Egypt,"4 Vacancies, MS Office, Logistics, Supply Chain, Purchasing, Procurement, Warehousing, Logistics/Supply Chain"
Graphic Designer,Arabic Trader, Dokki,Full Time,Entry Level,1+ Yrs of Exp,Giza,"Adobe Illustrator, Adobe Indesign, Adobe Photoshop, Applied Arts, Web Design, HTML, CSS, javaScript, Fine Arts, Social Media"
Sales Supervisor - German Speaker,idaco, 6th of October,Full Time,Experienced,6+ Yrs of Exp,Giza,"Sales Skills, German, Sales Target, Sales/Retail"
Indoor Sales Representative,Smart GYM, Nasr City,Full Time,Entry Level,1-2 Yrs of Exp,Cairo,"Customer Service, Customer Care, Selling Skills, Customer Support, Indoor Sales, Sales Target, Customer Service/Support, Sales/Retail"
Supply Chain Manager,Confidential, Obour City,Full Time,Manager,15+ Yrs of Exp,Cairo,"Supply Chain, Food and Beverage, AX, CSCP, Logistics, Commerce, CPIM, Logistics/Supply Chain, Purchasing/Procurement"
Accountant,Insitu Egypt, Maadi,Full Time,Experienced,2+ Yrs of Exp,Cairo,"Finance, Financial Analysis, Warehouse manager, Financial Management, Communication Skills, Accounting/Finance"
IT System Administrator - Minya,UD Crops, New Menia,Full Time,Experienced,2-4 Yrs of Exp,Minya,"Information Technology (IT), CCNA, System Administration, Security, Computer Science, Installation/Maintenance/Repair"
Reservation Agent (Hotels) - Alexandria,Paradise Inn Hotels & Resorts, Mahta Alraml,Full Time,Experienced,3+ Yrs of Exp,Alexandria,"Ticketing, Customer Service, Customer Care, Customer Support, Hotels, Fidelio Suite 8, Travel, Tourism, Hospitality, Booking"
Photographer / Filmmaker,ArabAps, Nasr City,Full Time,Experienced,2-4 Yrs of Exp,Cairo,"Films, Videos, Photography, Videography, Filmmaking, English, Travel, E-marketing, Creative/Design/Art, Media/Journalism/Publishing"
Graphic Designer,EHG Group, New Cairo,Full Time,Experienced,5+ Yrs of Exp,Cairo,"Adobe Photoshop, Adobe Illustrator, Creative/Design/Art"
Courier,DHL Express Egypt, Cairo,Full Time,Entry Level,1-3 Yrs of Exp,Egypt,"Males Only, Courier, Logistics, Supply Chain, Operations, Delivery, Production, Support, Logistics/Supply Chain"
Mechanical Maintenance Engineer,Confidential, Sheraton,Full Time,Experienced,5-6 Yrs of Exp,Cairo,"Maintenance, Mechanical Engineering, Technical, Installation/Maintenance/Repair, Engineering - Mechanical/Electrical"
Architecture Site Engineer,El-Alameya for Engineering and Project Management, Cairo,Full Time,Experienced,3-5 Yrs of Exp,Egypt,"AutoCAD, Architecture, Design, Construction, Engineering - Construction/Civil/Architecture"
Sales Representative,Aircomfort company(Plac-viva), New Cairo,Full Time,Experienced,3+ Yrs of Exp,Cairo,"Sales Target, Sales Skills, Customer Service, Sales/Retail"
Production Manager - Cotton Socks,Aircomfort company(Plac-viva), New Cairo,Full Time,Manager,3+ Yrs of Exp,Cairo,"Operations, Management, Cotton, QA, QC, Quality Control, Quality Assurance, Operations/Management, Manufacturing/Production"
Technical Office Engineer - Architecture,El-Alameya for Engineering and Project Management, Mohandessin,Full Time,Experienced,5-10 Yrs of Exp,Giza,"Computer Skills, Microsoft Office, Microsoft Word, Microsoft Excel, Architecture, AutoCAD, Technical Office, English"
Membership Advisor (Sales) - Giza,The Science Gym, Giza,Full Time,Entry Level,1-3 Yrs of Exp,Egypt,"Sales Skills, Sales Target, Fitness, Club, Membership, Gym, Sales/Retail, Sports and Leisure"
Social Media Expert,Insitu Egypt, Maadi,Part Time,Freelance / Project,1+ Yrs of Exp,Cairo,"1+ Yrs of Exp, Communication Skills, E-marketing, Facebook, Social Media Channels, English, Content, Arabic"
Accountant,Confidential, New Cairo,Full Time,Experienced,2-3 Yrs of Exp,Cairo,"Microsoft Excel, Finance, Financial Analysis, Financial Management, Accountant, MS Excel, Pivot, Accounting Regulations"
General Accountant - Beni Suef,PENCILIGHT, Beni Suef,Full Time,Entry Level,0-6 Yrs of Exp,Beni Suef,"Manufacturing, Accounting, Commerce, Quickbooks, Bookkeeping, English, Arabic, Procurement, Finance, Accounting/Finance"
Head of KG Department,Prime International School, Cairo,Full Time,Manager,7+ Yrs of Exp,Egypt,"Education, Teaching, KG, Montessori, Operations/Management, Education/Teaching"
Treasury Accountant,Confidential, Nasr City,Full Time,Entry Level,1-3 Yrs of Exp,Cairo,"Finance, Treasury Accounting, Commerce, Accounting/Finance"
Project Coordinator - Giza,Al Arab Group, Sheikh Zayed,Full Time,Experienced,2-7 Yrs of Exp,Giza,"Administration, Project Coordination, English, Arabic, Administration, Project/Program Management"
Administrative Manager,Al Arab Group, Sheikh Zayed,Full Time,Manager,2-6 Yrs of Exp,Giza,"Office Management, Microsoft Office, Administration, Operations/Management"
Front End Developer ( Angular ),Artapart, Maadi,Full Time,Experienced,2-3 Yrs of Exp,Cairo,"Information Technology (IT), Computer Science, Software Development, javaScript, CSS, Git, SASS, Design, Redux, OOP, React"
Quality Assurance /Control Engineer,Gulsan Egypt Non-Woven Industries, 6th of October,Full Time,Entry Level,0-3 Yrs of Exp,Giza,"Quality Control, Quality Assurance, Engineering, Chemistry, Textile Engineer, Industrial Engineer, QA, QC, English, TO, Quality"
Senior Sales Executive,DM Arts, Cairo,Full Time,Experienced,3+ Yrs of Exp,Egypt,"Advertising, Lead Generation, Media, Sales Skills, Customer Service, Client Relations, Digital Marketing, Training"
Junior Property Consultant,Triumph Estate Group, Heliopolis,Full Time,Entry Level,1-2 Yrs of Exp,Cairo,"Sales Skills, Customer Service, Microsoft Office, English, Communication Skills, Brokerage, Sales Target, Real Estate, Sales/Retail"
Senior Site Architect,Asass, New Cairo,Full Time,Experienced,5-8 Yrs of Exp,Cairo,"Project Management, Residential, Commercial Projects, Engineering, Site, Finishing, Engineering - Construction/Civil/Architecture"
Logistics Operations Specialist,Transcesion VC, Mohandessin,Full Time,Experienced,3-5 Yrs of Exp,Giza,"Operations, Shipping, E-Commerce, Orders, Fleet Management, Computer Skills, Logistics/Supply Chain, Operations/Management"
Senior Sales Representative,Anasia Egypt for Trading, Sheraton,Full Time,Experienced,3-5 Yrs of Exp,Cairo,"Cisco, Sales Skills, Sales Target, English, Arabic, Sales/Retail"
Senior Property Consultant,Triumph Estate Group, Heliopolis,Full Time,Experienced,2-4 Yrs of Exp,Cairo,"Sales Skills, Sales Target, Brokerage, Real Estate, Communication Skills, Microsoft Office, English, Customer Service/Support"
Admin Coordinator,Engosoft, Nasr City,Full Time,Entry Level,1-3 Yrs of Exp,Cairo,"Administration, Microsoft Office, English, Communication Skills, Excel, Photoshop, Office Management, Administration"
Document Controller / Data Entry Agent,Transcesion VC, Mohandessin,Full Time,Experienced,2-4 Yrs of Exp,Giza,"Administration, Microsoft Office, MS Office, Document Control, Administration"
Claims Auditor - Giza,Cleopatra Hospitals Group, Mohandessin,Full Time,Entry Level,1-3 Yrs of Exp,Giza,"Medical Audits, Finance, Medicine, Financial Analysis, Accounting/Finance, R&D/Science, Medical/Healthcare"
Projects Sales Leader,Saint-Gobain, Cairo,Full Time,Manager,3-5 Yrs of Exp,Egypt,"Sales Target, Exterior Finishing Solutions, Interior Finishing Solutions, Plaster Boards, Ceiling Tiles, Constructions Chemicals"
Chemical Engineer - Lab Quality Engineer,Intrade, Cairo,Full Time,Experienced,3+ Yrs of Exp,Egypt,"R&D, Research & Development, Chemistry, Quality Assurance, Chemical Engineer, Coating Systems, Paint and Coating, Engineering"
Digital Marketing Content Creator,BICC Services Worldwide, Nasr City,Full Time,Experienced,2+ Yrs of Exp,Cairo,"English, Digital Marketing Content Creation, Writing/Editorial, Marketing/PR/Advertising, Media/Journalism/Publishing"
Junior Digital Marketing Content Creator,BICC Services Worldwide, Nasr City,Full Time,Entry Level,0-1 Yrs of Exp,Cairo,"English, Digital Marketing Content Creation, Writing/Editorial, Marketing/PR/Advertising, Media/Journalism/Publishing"
Marketing Manager,Confidential, Heliopolis,Full Time,Manager,5+ Yrs of Exp,Cairo,"Sales, Marketing Strategy, Marketing Plan, Marketing Campaign, Real Estate, Market Research, Marketing/PR/Advertising"
Senior PHP Developer,Confidential, Cairo,Full Time,Experienced,5+ Yrs of Exp,Egypt,"PHP, Computer Science, Software Development, MVC, Laravel, Programming, IT/Software Development"
Senior Planning Engineer - Architecture,El-Alameya for Engineering and Project Management, Dokki,Full Time,Experienced,5-10 Yrs of Exp,Giza,"BIM, Primavera P6, English, Cost control, Civil Engineering, Architecture, Project Management, Planning Engineer, CPM scheduling"
Key Account Manager (Media Storage),Allamna Integrated Solutions, Heliopolis,Full Time,Manager,4-6 Yrs of Exp,Cairo,"Business Administration, Media Storage, Microfilm, Account Management, Sales/Retail, Media/Journalism/Publishing"
Electrical Tendering Engineer,Tantamotors company, Nasr City,Full Time,Experienced,3-5 Yrs of Exp,Cairo,"Tendering, Purchasing, Procurement, Engineering - Mechanical/Electrical"
Mechanical Tendering Engineer,Tantamotors company, Nasr City,Full Time,Experienced,3-5 Yrs of Exp,Cairo,"Tendering, Microsoft Office, Purchasing, Procurement, Engineering - Mechanical/Electrical"
Project Coordinator,Confidential, Maadi,Full Time,Experienced,2+ Yrs of Exp,Cairo,"Petrol, Oil & Gas, Mechanical Engineering, Project Management, Production, Project/Program Management, Engineering - Mechanical/Electrical"
Presentation & Graphic Designer,MigrationIT.com, Cairo,Full Time,Experienced,3-5 Yrs of Exp,Egypt,"Adobe Illustrator, Adobe Photoshop, Adobe Creative Cloud, Video Editing, Prezi, Acrobat Pro, Creative/Design/Art"
Digital Marketing Executive,Confidential, Nasr City,Full Time,Experienced,3-5 Yrs of Exp,Cairo,"Digital Marketing, Social Media, Digital Media, Marketing/PR/Advertising, Media/Journalism/Publishing"
Software Developer - Experienced,HITS Technologies, Nasr City,Full Time,Experienced,3-6 Yrs of Exp,Cairo,"Information Technology (IT), Computer Science, Computer Engineering, Integration, Software Development, Software Engineering, JSON"
Junior QC Engineer,Flairstech, Maadi,Full Time,Entry Level,0-1 Yrs of Exp,Cairo,"Quality Control, English, Testing, Software, Computer Engineering, Computer Science, Information Technology (IT), API, QA, SQL"
System Engineer (Microsoft),Confidential, Cairo,Full Time,Experienced,3-8 Yrs of Exp,Egypt,"Computer Science, Microsoft Office, Telecom Engineering, Office365, Azure, AWS, Networking, Linux, SQL"
Senior Sales Specialist,NowPay, Downtown,Full Time,Manager,5-10 Yrs of Exp,Cairo,"Sales Skills, Sales Target, Indoor Sales, Marketing, Economics, Business Administration, Arabic, English, Excel, MS Office, Sales Plan"
Senior Software Sales Specialist,Expand Cart, 6th of October,Full Time,Experienced,2+ Yrs of Exp,Giza,"Sales Skills, Selling Skills, Sales Target, B2B Sales, Corporate Sales, CRM, Computer Science, Information Technology (IT), IT Sales"
System Engineer (VMware),Confidential, Cairo,Full Time,Experienced,3-8 Yrs of Exp,Egypt,"Computer Science, Computer Engineering, Cloud Management, VMWare, Linux, VSphere, Virtualization, Infrastructure"
French Customer Service Representative,Sykes Enterprises, Maadi,Full Time,Shift Based,0-2 Yrs of Exp,Cairo,"2 Vacancies, Customer Support, Customer Service, Customer Care, French, English, Customer Service/Support"
Sales Promoter,Egytrend, Sheraton,Full Time,Entry Level,1-5 Yrs of Exp,Cairo,"Males Only, Sales Skills, Customer Support, Sales Target, English, Electronics, Sales/Retail"
Senior Payable Accountant,Royal Lab, Heliopolis,Full Time,Experienced,6-8 Yrs of Exp,Cairo,"Accounting, Finance, Microsoft Excel, Financial Management, Financial Analysis, Computer Skills, Medical, Accounting/Finance"
Digital Marketing Designer,Petro Group Mitsubishi Service, Moharam Bek,Full Time,Experienced,3-6 Yrs of Exp,Alexandria,"Social Media, Graphic Design, Video Editing, Communication Skills, Web Design, Creative/Design/Art, Marketing/PR/Advertising"
Property Consultant Real Estate,Havana Hills, 6th of October,Full Time,Entry Level,1-3 Yrs of Exp,Giza,"Males Only, Real Estate, Sales Skills, Sales Target, Communication Skills, Sales/Retail"
Help Desk Administrator,Onecard, Nasr City,Full Time,Entry Level,0-1 Yrs of Exp,Cairo,"Installation, Technical Support, Hardware, Information Technology (IT), Computer Science, Software, Testing, Linux, Administration"
Senior Recruitment Specialist,Qsource, New Cairo,Full Time,Experienced,2+ Yrs of Exp,Cairo,"Human Resources (HR), Recruiting, Personnel, Microsoft Office, Selecting, Interviewing, English, Human Resources"
Operational Team Leader- French Speaker...,Majorel Egypt, Alexandria,Full Time,Manager,1-3 Yrs of Exp,Egypt,"Operations, Team Leader, Management, MS Office, Leadership Skills, Customer Service, French, Customer Support, Customer Service/Support"
Sales Representative - Furniture,Confidential, Giza,Full Time,Experienced,2+ Yrs of Exp,Egypt,"Sales Target, Sales Skills, Communication Skills, Selling, English, Sales/Retail"
PYP German Teacher,Notion International School, Faisal,Full Time,Experienced,5+ Yrs of Exp,Giza,"Teaching, German, IB Schools, MYP, PYP, IB, English, Education/Teaching"
Accountant,Confidential, Heliopolis,Full Time,Experienced,2-3 Yrs of Exp,Cairo,"English, Office, Finance, Financial Analysis, Financial Management, Accounting/Finance"
Mechanical Engineer,Al Safa, Nasr City,Full Time,Experienced,5-10 Yrs of Exp,Cairo,"Mechanical Engineering, Communication Skills, Construction, Engineering - Mechanical/Electrical"
Business Consultant,Ultimate Solutions Egypt, 6th of October,Full Time,Entry Level,0-2 Yrs of Exp,Giza,"Business Consultant, banking system, accounting, Business Development, Finance, Management, Consultancy, Retail, Analytical"
Advertising Sales Executive,TAG ADVERTISING, Nasr City,Full Time,Entry Level,1-2 Yrs of Exp,Cairo,"Sales Skills, Sales Target, Advertising, Customer Service, Marketing/PR/Advertising, Sales/Retail"
Data Analyst,United Distributors, Garden City,Full Time,Experienced,5-7 Yrs of Exp,Cairo,"Data Analysis, Business, English, Tableau, IT/Software Development, Analyst/Research"
Project Engineer,Andalusia Group, Maadi,Full Time,Experienced,2+ Yrs of Exp,Cairo,"Petrol, Mechanical Engineering, Project Management, Mechanical Production, Planning, Oil & Gas, Electrical, Project/Program Management"
Technical Support Specialist,Allamna Integrated Solutions, Heliopolis,Full Time,Experienced,2-4 Yrs of Exp,Cairo,"Information Technology (IT), Computer Science, Troubleshooting, Communication, Engineering, Telecom, Installation"
Senior Technical Writer,Flairstech, Cairo,Full Time,Experienced,3-5 Yrs of Exp,Egypt,"CSS, HTML, Computer Science, Microsoft Office, English, XML, Computer Engineering, Information Technology (IT)"
Material Planner,Confidential, Obour City,Full Time,Experienced,2+ Yrs of Exp,Cairo,"Supply Chain, Materiel Planning, Commerce, Food, Production, English, Logistics/Supply Chain, Purchasing/Procurement"
Senior General Accountant,A-Squared, New Cairo,Full Time,Experienced,5-7 Yrs of Exp,Cairo,"Finance, Accounting Software, English, Cost Accounting, General Ledger, Construction, Microsoft Office, Computer Skills"
Retail Operations Director (Non-food) / VP Retail...,Raneen, Giza,Full Time,Senior Management,15-20 Yrs of Exp,Giza,"Business acumen Result oriented Market Share Multiple Categories, Operations/Management, Sales/Retail"
Sales Specialist - Freight Forwarding,Pro Grow, Nasr City,Full Time,Experienced,2+ Yrs of Exp,Cairo,"Males Preferred, Freight Forwarding, Freight Sales, Sales Skills, Customer Support, Shipping, Customer Service/Support, Sales/Retail"
